{
  "openaisf_evidence": "1.0",
  "subject": {
    "system_id": "urn:openaisf:system:acme-support-agent",
    "artefact_digest": "sha256:1f0c9a2b3d4e5f60"
  },
  "control": "D07-C01",
  "plane": "data",
  "window": {
    "from": "2026-08-06T13:16:54+00:00",
    "to": "2026-08-07T13:16:54+00:00"
  },
  "observations": {
    "traffic_requests": 184203,
    "decisions_total": 184203,
    "allowed": 183994,
    "denied": 209,
    "undeclared_attempts": 6
  },
  "producer": {
    "adapter": "openaisf-adapter-reference-gateway",
    "version": "1.0.0"
  },
  "signature": {
    "scheme": "sha256-digest",
    "value": "c7d180600fc0df98338ecf40f8e41813e23cd106dbe15b00ffdf26257ff60d7b",
    "key_id": "reference-gateway"
  }
}
